{
  "contract_version": 1,
  "mode": "tracked",
  "profiles": ["research-corpus"],
  "docs_root": "docs",
  "ownership_policy": {
    "portable_skill_authoring_owner": "agent-repo-kit",
    "domain_knowledge_owner": "repo-maintainers",
    "repo_local_skills": {
      "allowed": false,
      "placement_roots": [".claude/skills", ".agents/skills"],
      "authoring_owner": "agent-repo-kit",
      "requires_justification": true
    }
  },
  "required_files": [
    "AGENTS.md",
    "CLAUDE.md",
    "Taskfile.yml",
    "README.md",
    "docs/README.md",
    "docs/requests/README.md",
    "docs/planning/README.md",
    "docs/plans/README.md",
    "docs/implementation/README.md",
    "docs/taxonomy/README.md",
    ".work/.gitignore",
    ".work/config.yaml"
  ],
  "taskfile_checks": {
    "Taskfile.yml": ["check:conventions:", "work:", "work:check:", "verify:"]
  },
  "mirror_policy": {
    "mode": "mirrored",
    "files": ["CLAUDE.md", "AGENTS.md"]
  },
  "canonical_pointer_mode": "all",
  "canonical_pointers": [],
  "content_checks": [
    {
      "name": "agents-conventions",
      "file": "AGENTS.md",
      "required_markers": [
        "## Conventions",
        "**Docs**",
        "**Work**",
        ".convention-engineering.json",
        ".work/config.yaml",
        "`task verify`"
      ]
    },
    {
      "name": "claude-conventions",
      "file": "CLAUDE.md",
      "required_markers": [
        "## Conventions",
        "**Docs**",
        "**Work**",
        ".convention-engineering.json",
        ".work/config.yaml",
        "`task verify`"
      ]
    },
    {
      "name": "docs-root-explained",
      "file": "docs/README.md",
      "required_markers": [
        ".convention-engineering.json",
        "requests/",
        "planning/",
        "plans/"
      ]
    }
  ],
  "git_exclude_checks": [],
  "invariant_contract": {
    "required": false
  },
  "evaluation_inputs": {
    "repo_risk": "standard"
  },
  "chunk_plan": {
    "enabled": false,
    "chunks": []
  }
}
